{
  "schema_version": "semantic-yield-fixture@1",
  "fixture_id": "cvrngaqzq3y-v2-semantic-yield",
  "required": {
    "knowledge_units": [
      "determinism-for-autonomy-tradeoff",
      "traces-as-improvement-substrate",
      "trace-reading-cost-bottleneck",
      "open-model-judge-cost-claim",
      "harness-finetune-sandwich",
      "model-harness-task-fit",
      "continual-learning-three-axes",
      "four-step-improvement-recipe",
      "dense-feedback-beats-pass-fail",
      "three-trace-mining-outputs"
    ],
    "relation_ids": [
      "REL-agent-autonomy-trades-off-with-is-traded-against-44912ed2a046",
      "REL-context-window-limit-depends-on-bounds-trace-min-3132d7eb9573",
      "REL-generated-evals-enables-constrains-harness-engin-59f00567c498",
      "REL-harness-updates-part-of-is-one-axis-of-agent-mem-998fdec54f64",
      "REL-model-harness-task-fit-causes-determines-agent-t-d2cd283cd3cc",
      "REL-observational-training-data-part-of-is-one-axis-c414b15e8850",
      "REL-open-model-judge-analogous-to-approaches-far-mor-cc4f09893616",
      "REL-runtime-traces-feeds-feeds-trace-mining-95508872354a",
      "REL-runtime-traces-flows-to-is-collected-after-shipp-f331f0fb80af",
      "REL-static-predictability-causes-lowers-which-elevat-1097d48a1bd8",
      "REL-trace-mining-transforms-produces-generated-evals-d54d3910d5ec"
    ],
    "visual_ids": [
      "VIS-v2-fit-equation-slide",
      "VIS-v2-harness-sandwich-slide",
      "VIS-v2-continual-learning-axes-slide",
      "VIS-v2-legal-benchmark-chart"
    ],
    "projection_kinds": [
      "causal-dataflow",
      "comparison-matrix",
      "equation",
      "state-planes",
      "timeline"
    ],
    "question_tags": [
      "bottleneck",
      "comparison",
      "core-conflict",
      "dataflow",
      "decision-rule",
      "equation",
      "state-model",
      "timeline",
      "uncertainty"
    ]
  },
  "forbidden_precision_patterns": [
    "\\b\\d+(?:\\.\\d+)?\\s*%\\s*(?:cheaper|better|faster)\\b",
    "\\bexactly\\s+\\d+\\s*(?:orders?|x)\\b",
    "\\$\\d+(?:\\.\\d+)?\\s*(?:per|/)\\s*(?:million|1M)\\b",
    "\\bLangSplat\\s+engine\\b(?!\\s*\\()"
  ],
  "thresholds": {
    "HG-01": 1.0,
    "HG-02": 1.0,
    "HG-03": 1.0,
    "HG-04": 1.0,
    "HG-05": 0.95,
    "HG-06": 1.0
  },
  "redundancy_similarity_threshold": 0.84
}
